{
  "$schema": "http://json-schema.org/draft-07/schema#",
  "$id": "https://cubica.platform/games/cards-money-trains/asset-provenance.schema.json",
  "title": "Cards, Money, Trains asset & source-material provenance registry",
  "description": "Реестр происхождения (provenance): для игры «Карты, деньги, поезда» перечисляет все первоисточники (файлы, полученные напрямую от автора/правообладателя игры) и производные ассеты платформы, а также права на их использование. Реестр — список записей, а не одна запись, потому что производные артефакты уже создаются из нескольких разных первоисточников (растровая и векторная карта). Каждая запись самодостаточна: по ней одной видно, что это за файл, откуда он взят, можно ли его публиковать и кто это подтвердил.",
  "type": "object",
  "additionalProperties": false,
  "required": ["$schema", "schemaVersion", "gameId", "locationNotice", "entries"],
  "properties": {
    "$schema": { "const": "asset-provenance.schema.json" },
    "schemaVersion": { "const": "1.0" },
    "gameId": { "const": "cards-money-trains" },
    "locationNotice": {
      "type": "string",
      "minLength": 1,
      "description": "Верхнеуровневое примечание о том, что текущее место хранения авторских первоисточников (каталог draft/) пересматривается отдельной задачей и что пути в этом реестре могут измениться по итогам того решения."
    },
    "entries": {
      "type": "array",
      "minItems": 1,
      "maxItems": 4096,
      "items": { "$ref": "#/definitions/entry" }
    }
  },
  "definitions": {
    "sha256": {
      "type": "string",
      "description": "Отпечаток SHA-256 (sha256) содержимого файла в нижнем регистре hex — 64 символа. Позволяет проверить, что файл не подменён и не повреждён.",
      "pattern": "^[a-f0-9]{64}$"
    },
    "stableId": {
      "type": "string",
      "description": "Устойчивый (не меняющийся между перегенерациями реестра) идентификатор ассета или первоисточника в формате kebab-case.",
      "pattern": "^[a-z][a-z0-9]*(-[a-z0-9]+)*$",
      "minLength": 3,
      "maxLength": 128
    },
    "repositoryPath": {
      "type": "string",
      "description": "Относительный путь к файлу, использующий прямой слэш как разделитель. База отсчёта (корень репозитория или корень пакета игры) задаётся соседним полем root.",
      "minLength": 1,
      "pattern": "^[^\\\\]+$"
    },
    "pathRoot": {
      "description": "База, относительно которой понимается путь записи. \"repo\" — корень репозитория Cubica-AI (используется для авторских первоисточников вне пакета игры, например каталога draft/). \"game\" — корень пакета этой игры, games/cards-money-trains/ (используется для ассетов, которые публикуются вместе с игрой). Поле обязательно, потому что в этом реестре сведены пути с разными базами: доставляемые ассеты лежат внутри пакета игры, а авторские первоисточники — вне его.",
      "enum": ["repo", "game"]
    },
    "contentType": {
      "type": "string",
      "description": "Тип содержимого (аналог MIME-типа), описывающий формат файла.",
      "minLength": 1
    },
    "rights": {
      "type": "object",
      "description": "Блок прав: кто и когда подтвердил разрешение на использование файла, и что именно разрешено. Обязателен для каждой записи реестра, включая первоисточники — без него нельзя решить, можно ли публиковать производные.",
      "additionalProperties": false,
      "required": [
        "status",
        "license",
        "owner",
        "publicationAllowed",
        "modificationAllowed",
        "distributionChannels",
        "confirmedBy",
        "confirmedAt",
        "note"
      ],
      "properties": {
        "status": {
          "description": "Итоговый статус подтверждения прав на файл.",
          "enum": ["confirmed", "pending", "unknown"]
        },
        "license": {
          "type": "string",
          "minLength": 1,
          "description": "Короткий машинно-читаемый код основания использования (например, прямое разрешение автора/правообладателя)."
        },
        "owner": {
          "type": "string",
          "minLength": 1,
          "description": "Владелец/правообладатель материала в том виде, в каком он зафиксирован в метаданных репозитория."
        },
        "publicationAllowed": {
          "type": "boolean",
          "description": "Разрешена ли публикация файла или производных от него в игровом пакете/приложении."
        },
        "modificationAllowed": {
          "type": "boolean",
          "description": "Разрешено ли создавать производные (изменённые) артефакты на основе этого файла."
        },
        "distributionChannels": {
          "type": "array",
          "minItems": 1,
          "maxItems": 32,
          "items": { "type": "string", "minLength": 1 },
          "description": "Перечень каналов, где допускается распространять файл или его производные."
        },
        "confirmedBy": {
          "type": "string",
          "minLength": 1,
          "description": "Кто подтвердил права (роль или должность, например PM)."
        },
        "confirmedAt": {
          "type": "string",
          "pattern": "^[0-9]{4}-[0-9]{2}-[0-9]{2}$",
          "description": "Дата подтверждения прав в формате ГГГГ-ММ-ДД."
        },
        "note": {
          "type": "string",
          "minLength": 1,
          "description": "Свободное текстовое примечание с контекстом подтверждения: что именно было согласовано и на что оно распространяется."
        }
      }
    },
    "sourceDescriptor": {
      "type": "object",
      "description": "Описание первоисточника, из которого получена производная запись: собственный путь, тип содержимого, размер и отпечаток.",
      "additionalProperties": false,
      "required": ["path", "root", "contentType", "byteSize", "sha256"],
      "properties": {
        "path": { "$ref": "#/definitions/repositoryPath" },
        "root": { "$ref": "#/definitions/pathRoot" },
        "contentType": { "$ref": "#/definitions/contentType" },
        "width": { "type": "integer", "minimum": 1 },
        "height": { "type": "integer", "minimum": 1 },
        "byteSize": { "type": "integer", "minimum": 0 },
        "sha256": { "$ref": "#/definitions/sha256" }
      }
    },
    "derivedFrom": {
      "type": "object",
      "description": "Описание преобразования: из какого первоисточника и каким инструментом с какими параметрами получена производная запись.",
      "additionalProperties": false,
      "required": ["source", "transform"],
      "properties": {
        "source": { "$ref": "#/definitions/sourceDescriptor" },
        "transform": {
          "type": "object",
          "description": "Параметры инструмента преобразования. Состав полей зависит от конкретного инструмента конвейера сборки ассетов, поэтому объект не закрыт (additionalProperties не запрещены) — обязательны только имя и версия инструмента, чтобы преобразование можно было воспроизвести.",
          "additionalProperties": true,
          "required": ["tool", "toolVersion"],
          "properties": {
            "tool": { "type": "string", "minLength": 1 },
            "toolVersion": { "type": "string", "minLength": 1 }
          }
        }
      }
    },
    "derivedAssetEntry": {
      "type": "object",
      "description": "Запись о производном ассете платформы, полученном из одного авторского первоисточника.",
      "additionalProperties": false,
      "required": [
        "id",
        "path",
        "root",
        "kind",
        "contentType",
        "byteSize",
        "sha256",
        "derivedFrom",
        "rights"
      ],
      "properties": {
        "id": { "$ref": "#/definitions/stableId" },
        "path": { "$ref": "#/definitions/repositoryPath" },
        "root": { "$ref": "#/definitions/pathRoot" },
        "kind": { "const": "derived-asset" },
        "contentType": { "$ref": "#/definitions/contentType" },
        "width": { "type": "integer", "minimum": 1 },
        "height": { "type": "integer", "minimum": 1 },
        "byteSize": { "type": "integer", "minimum": 0 },
        "sha256": { "$ref": "#/definitions/sha256" },
        "derivedFrom": { "$ref": "#/definitions/derivedFrom" },
        "rights": { "$ref": "#/definitions/rights" }
      }
    },
    "sourceOriginalEntry": {
      "type": "object",
      "description": "Запись о первоисточнике: файле, полученном напрямую от автора/правообладателя игры и не являющемся производной от другого файла в этом реестре.",
      "additionalProperties": false,
      "required": ["id", "path", "root", "kind", "contentType", "byteSize", "sha256", "rights"],
      "properties": {
        "id": { "$ref": "#/definitions/stableId" },
        "path": { "$ref": "#/definitions/repositoryPath" },
        "root": { "$ref": "#/definitions/pathRoot" },
        "kind": { "const": "source-original" },
        "contentType": { "$ref": "#/definitions/contentType" },
        "width": { "type": "integer", "minimum": 1 },
        "height": { "type": "integer", "minimum": 1 },
        "byteSize": { "type": "integer", "minimum": 0 },
        "sha256": { "$ref": "#/definitions/sha256" },
        "rights": { "$ref": "#/definitions/rights" }
      }
    },
    "entry": {
      "description": "Одна запись реестра: либо первоисточник (source-original), либо производный ассет (derived-asset). Вид записи задаётся полем kind и определяет, какие дополнительные поля обязательны.",
      "oneOf": [
        { "$ref": "#/definitions/derivedAssetEntry" },
        { "$ref": "#/definitions/sourceOriginalEntry" }
      ]
    }
  }
}
